<?xml version="1.0" encoding="UTF-8"?>

<xs:schema xmlns:xs="http://www.w3.org/2001/XMLSchema">
  <xs:element name="cities">
    <xs:complexType>
      <xs:sequence>
        <xs:element name="city" maxOccurs="unbounded">
          <xs:complexType>
            <xs:sequence>
              <xs:element name="city_id" type="xs:int" minOccurs="1"/>
              <xs:element name="name" type="xs:string"/>
              <xs:element name="country" type="xs:string"/>
              <xs:element name="description" type="xs:string"/>
              <xs:element name="latitude" type="xs:string"/>
              <xs:element name="longitude" type="xs:string"/>
              <xs:element name="population" type="xs:int"/>
              <xs:element name="currency" type="xs:string"/>
              <xs:element name="tags" type="xs:string"/>
            </xs:sequence>
          </xs:complexType>
        </xs:element>
      </xs:sequence>
    </xs:complexType>
  </xs:element>
</xs:schema>
